{
  "schema_version": "1",
  "id": "BB-PLAN-016",
  "title": "Planning and delivery contract with bounded consumer corrections",
  "objective": "Deliver the approved five-part planning kit with accurate source attribution, include triaged prior review points and confirmed narrow consumer corrections, and publish an independently reviewed PR.",
  "role": "implementer",
  "risk": "high",
  "repository": {
    "base_branch": "main",
    "base_revision": "4394763d03c1d1302b6b37cef142d0f98f848be4",
    "head_revision": null
  },
  "approved_sources": [
    "User authorization 2026-10-21: implement discussed planning documentation, include independent review points and source hints, create a PR.",
    "docs/agent-governance/core.md",
    "docs/agent-governance/planning.md",
    "docs/agent-governance/architecture.md",
    "docs/quality/policy.md",
    "docs/quality/testing.md",
    "docs/changes/backbone-planning-delivery/plan.md"
  ],
  "scope": {
    "include": [
      "AGENTS.md",
      "CONTRIBUTING.md",
      "README.md",
      ".gitattributes",
      ".github/copilot-instructions.md",
      ".github/workflows/quality.yml",
      ".github/workflows/governance-checks.yml",
      ".github/workflows/opencode-native.yml",
      "docs/agent-governance/**",
      "docs/architecture/README.md",
      "docs/requirements/README.md",
      "docs/templates/planning/**",
      "docs/quality/policy.md",
      "docs/quality/testing.md",
      "docs/operations/engineering/**",
      "docs/changes/README.md",
      "docs/changes/backbone-planning-delivery/**",
      ".engineering-backbone/src/validate.py",
      ".engineering-backbone/legacy/templates/**",
      ".engineering-backbone/tst/**"
    ],
    "exclude": [
      ".engineering-backbone/schemas/**",
      ".engineering-backbone/standards/**",
      ".engineering-backbone/tst/fixtures/**",
      "apps/**",
      "packages/**",
      "docs/changes/backbone-architecture-contract/**"
    ]
  },
  "acceptance": [
    {
      "id": "AC-1",
      "description": "Canonical iterative and proportionate requirements/architecture-to-planning-to-delivery handoff, responsibility, coverage and change impact.",
      "verification": "hybrid",
      "status": "pending",
      "evidence": []
    },
    {
      "id": "AC-2",
      "description": "Complete reusable planning kit and coherent hypothetical parallel-delivery example without invented approval or PASS.",
      "verification": "hybrid",
      "status": "pending",
      "evidence": []
    },
    {
      "id": "AC-3",
      "description": "Accurate primary-source notes distinguish public standard scope, optional methods and Backbone-owned rules.",
      "verification": "hybrid",
      "status": "pending",
      "evidence": []
    },
    {
      "id": "AC-4",
      "description": "Source and legacy distribution/update preserve context links, project ownership, native instructions and existing schema/state contracts.",
      "verification": "hybrid",
      "status": "pending",
      "evidence": []
    },
    {
      "id": "AC-5",
      "description": "Product fixtures are outside governance scanning; malformed governance remains rejected; complete historical bytes survive autocrlf and diagnostics are portable.",
      "verification": "hybrid",
      "status": "pending",
      "evidence": []
    },
    {
      "id": "AC-6",
      "description": "Source CI remains repository/trust bound, uses local runners without hosted fallback or uploads, retains checks and reports unavailable evidence honestly.",
      "verification": "hybrid",
      "status": "pending",
      "evidence": []
    },
    {
      "id": "AC-7",
      "description": "All incoming review points are triaged; neutral-export and optional-profile follow-up scope/acceptance are explicit.",
      "verification": "hybrid",
      "status": "pending",
      "evidence": []
    },
    {
      "id": "AC-8",
      "description": "Actual checks, independent plan/Full/Delta reviews and triage support the published PR; no merge/release.",
      "verification": "hybrid",
      "status": "pending",
      "evidence": []
    }
  ],
  "validation": {
    "commands": [
      "python .engineering-backbone/src/validate.py",
      "python .engineering-backbone/src/maintenance/compile_toolchain_fingerprint.py --check",
      "python .engineering-backbone/src/maintenance/compile_workflow_kit.py --check",
      "python .engineering-backbone/src/maintenance/compile_navigation.py --check",
      "python .engineering-backbone/src/maintenance/compile_quality_framework.py --check",
      "python .engineering-backbone/src/check_source_dependencies.py",
      "python -m unittest discover -s .engineering-backbone/tst -t .engineering-backbone -v",
      "git diff --check BASE HEAD"
    ],
    "manual_evidence": [
      "Independent plan review before implementation",
      "Separate quality execution and frozen behavior/authority Full reviews; triage and bounded Delta as needed",
      "Hypothetical worked-example and source-provenance walkthrough",
      "Incoming-review disposition and actual remote CI readback"
    ]
  },
  "execution_budget": {
    "max_iterations": 6
  },
  "stop_conditions": [
    "Scope or trust-boundary expansion requires updated independently reviewed plan.",
    "Stop if source requirements or authorities conflict, required evidence cannot be obtained, or review budget is exhausted.",
    "At most two Full rounds for this scope; triage before repair."
  ],
  "forbidden_actions": [
    "No merge, release, deployment, repository protection or runner provisioning changes.",
    "No invented approval/runtime evidence, weakened gates, mandatory tool/domain stack, or product implementation.",
    "No schema/state extensions, historical fixture rewrites, automatic downstream application or neutral-export runtime.",
    "No source CI hosted-runner fallback or GitHub artifact upload."
  ],
  "status": "active"
}
